{
  "schema_version": "1.0.0",
  "capture_id": "synthetic-derived-omitted-0001",
  "created_at": "2026-09-22T09:00:00Z",
  "device": {"platform": "iOS", "model": "iPhone 16 Standard", "os_version": "18.6"},
  "capture_mode": {"mode": "freehand", "version": 1},
  "payloads": [
    {"path": "images/0001.jpg", "kind": "image", "required": true, "authority": "source", "size_bytes": 4, "sha256": "aaaaaaaaaaaaaaaaaaaaaaaaaaaaaaaaaaaaaaaaaaaaaaaaaaaaaaaaaaaaaaaa", "media_type": "image/jpeg"},
    {"path": "metadata/photos.json", "kind": "photo_metadata", "required": true, "authority": "source", "size_bytes": 2, "sha256": "bbbbbbbbbbbbbbbbbbbbbbbbbbbbbbbbbbbbbbbbbbbbbbbbbbbbbbbbbbbbbbbb", "media_type": "application/json"}
  ],
  "source_evidence": {"immutable": true, "authority": "original_capture", "provenance": "synthetic-fixture"},
  "checksums": {"algorithm": "sha256", "canonicalization": "sha256_32_bytes_lowercase_hex_64_chars_v1"}
}
